author,description,url,image_path
Cash Macanaya,a view of the earth from space at night,https://plus.unsplash.com/premium_photo-1713163890188-6807aa2641de?ixid=M3wxMjA3fDB8MXxhbGx8MTJ8fHx8fHwyfHwxNzEzMzI1MDkwfA&ixlib=rb-4.0.3,full/41432595bdd4327c0272ea26d7ee76528e988e6c.jpg
Galina Nelyubova,a group of trees growing out of a white box,https://plus.unsplash.com/premium_photo-1713218938934-16dfe759633c?ixid=M3wxMjA3fDB8MXxhbGx8MjJ8fHx8fHwyfHwxNzEzMzI1MDkwfA&ixlib=rb-4.0.3,full/9b88fae1d036529bf197d6eb484eefe221c76565.jpg
Gantas Vaičiulėnas,a person standing on a beach next to the ocean,https://plus.unsplash.com/premium_photo-1709461950955-61670840400e?ixid=M3wxMjA3fDB8MXxhbGx8MTd8fHx8fHwyfHwxNzEzMzI1MDkwfA&ixlib=rb-4.0.3,full/8ebae972da1daeb482e9ffd785511ffd36752f9a.jpg
Kristaps Ungurs,an aerial view of the ocean and land covered in ice,https://plus.unsplash.com/premium_photo-1674599003901-7794de153bbe?ixid=M3wxMjA3fDB8MXxhbGx8Mnx8fHx8fDJ8fDE3MTMzMjUwOTB8&ixlib=rb-4.0.3,full/3f8562287a8b69de2eb146c479267f7de4d7bfe2.jpg
Ahmed Ali,a person standing on a street holding an umbrella,https://images.unsplash.com/photo-1712781797301-ec9ee12b52b4?ixid=M3wxMjA3fDB8MXxhbGx8NXx8fHx8fDJ8fDE3MTMzMjUwOTB8&ixlib=rb-4.0.3,full/61bcd7e0eeed5e2951e4cfab57b43b488bdf4109.jpg
Pawel Czerwinski,a black background with a large flower in the center,https://images.unsplash.com/photo-1712945382945-8bdfe31d4335?ixid=M3wxMjA3fDB8MXxhbGx8OXx8fHx8fDJ8fDE3MTMzMjUwOTB8&ixlib=rb-4.0.3,full/af7e139b8135dd3b16a6b7e54a881776f99f2aa9.jpg
ABSOLUT,Ai generated portrait of a blond model with bare shoulders,https://images.unsplash.com/photo-1712857329031-eecb5980eec7?ixid=M3wxMjA3fDF8MXxhbGx8Nnx8fHx8fDJ8fDE3MTMzMjUwOTB8&ixlib=rb-4.0.3,full/7b47c0c8094428b332f9be5fe93f842db32bafc7.jpg
Claudio Schwarz,a building on top of a mountain with a moon in the sky,https://images.unsplash.com/photo-1712839398257-8f7ee9127998?ixid=M3wxMjA3fDB8MXxhbGx8M3x8fHx8fDJ8fDE3MTMzMjUwOTB8&ixlib=rb-4.0.3,full/cc0e5c35a28a46b70b4f998e4b3a0877f29439f8.jpg
Jefferson Sees,a couple of people that are looking out a window,https://images.unsplash.com/photo-1713193403534-45990577ec40?ixid=M3wxMjA3fDB8MXxhbGx8MTR8fHx8fHwyfHwxNzEzMzI1MDkwfA&ixlib=rb-4.0.3,full/f34e968a1ed2520ca66518732e9b290843b0bed4.jpg
Ahmed Ali,a train traveling down a street next to a tall building,https://images.unsplash.com/photo-1710101749861-aef7c032d24d?ixid=M3wxMjA3fDB8MXxhbGx8NHx8fHx8fDJ8fDE3MTMzMjUwOTB8&ixlib=rb-4.0.3,full/c2cc733d429a081ee3f74781ee01293000890f9f.jpg
Natalia Blauth,a person sitting on the floor with a blue leash,https://plus.unsplash.com/premium_photo-1712438461355-f29fbcaceccd?ixid=M3wxMjA3fDB8MXxhbGx8N3x8fHx8fDJ8fDE3MTMzMjUwOTB8&ixlib=rb-4.0.3,full/97360619868da354c986f04e3dea24b639d530a7.jpg
Ave Calvar,a white background with wavy lines,https://plus.unsplash.com/premium_photo-1666739087726-3aadc2376c28?ixid=M3wxMjA3fDB8MXxhbGx8MzJ8fHx8fHwyfHwxNzEzMzI0NjMyfA&ixlib=rb-4.0.3,full/c60d1bd1e65d6c6042ab083b72f4b25140339092.jpg
SALEH,the stars shine brightly in the sky above a canyon,https://images.unsplash.com/photo-1712277851184-fe23844036ab?ixid=M3wxMjA3fDB8MXxhbGx8OHx8fHx8fDJ8fDE3MTMzMjUwOTB8&ixlib=rb-4.0.3,full/bda2310c5d2b5ddbe447a8d8a79eaa419d69b0be.jpg
Lukas Zischke,a stairway leading up to a set of stairs,https://images.unsplash.com/photo-1713196157990-ea5ddd26fed7?ixid=M3wxMjA3fDB8MXxhbGx8MTl8fHx8fHwyfHwxNzEzMzI1MDkwfA&ixlib=rb-4.0.3,full/78cfc0654aea39203cabdfd0b7b62b0c3060b602.jpg
Dima Kapralov,a woman in a blue dress reaching up into the air,https://images.unsplash.com/photo-1713190200767-f7d8a58e84a8?ixid=M3wxMjA3fDB8MXxhbGx8MTB8fHx8fHwyfHwxNzEzMzI1MDkwfA&ixlib=rb-4.0.3,full/c9490c3c51a878f8b176fa27fdef1e924547d545.jpg
Marc Sendra Martorell,a starry night sky with a bright light in the middle,https://plus.unsplash.com/premium_photo-1669834415451-a197e9a344c2?ixid=M3wxMjA3fDB8MXxhbGx8Mjd8fHx8fHwyfHwxNzEzMzI0NjMyfA&ixlib=rb-4.0.3,full/52b9ab4bd990f7d40d5544f221354c65700fc492.jpg
NASA Hubble Space Telescope,a man in a space suit standing in front of a space station,https://images.unsplash.com/photo-1712512162273-2a622d8b0c74?ixid=M3wxMjA3fDB8MXxhbGx8MTN8fHx8fHwyfHwxNzEzMzI1MDkwfA&ixlib=rb-4.0.3,full/b75668a8fefe72d9553fadfce6fc76c9ba58c00f.jpg
ISKRA Photography,a rocky beach with a bunch of rocks in the water,https://images.unsplash.com/photo-1712312640787-a0b0cc94356e?ixid=M3wxMjA3fDB8MXxhbGx8MTh8fHx8fHwyfHwxNzEzMzI1MDkwfA&ixlib=rb-4.0.3,full/a85d69d694b1fd54e6109a8f892c8d6c82ff8ab1.jpg
ABSOLUT,Ai generated image of a gray haired model looking at camera with chin on hand,https://images.unsplash.com/photo-1712847333371-9ab4b8cebccf?ixid=M3wxMjA3fDF8MXxhbGx8MXx8fHx8fDJ8fDE3MTMzMjUwOTB8&ixlib=rb-4.0.3,full/8e727e0db601a00a24223d289734a12ec58316f1.jpg
Vusal Ibadzade,a close up of a person holding a wedding ring,https://images.unsplash.com/photo-1713211460724-7d7f608528a8?ixid=M3wxMjA3fDB8MXxhbGx8MTV8fHx8fHwyfHwxNzEzMzI1MDkwfA&ixlib=rb-4.0.3,full/0c80729e2a10941c6c13e3bc7820feb7fc38a54c.jpg
Pawel Czerwinski,a close up of a black and green flower,https://images.unsplash.com/photo-1713170860734-a897fd3912ea?ixid=M3wxMjA3fDB8MXxhbGx8MjN8fHx8fHwyfHwxNzEzMzI1MDkwfA&ixlib=rb-4.0.3,full/5242adeef6477335e46d9de2c566660e7f0b788e.jpg
Dima Kapralov,a woman in a black bra looking through a hole in a sheet,https://images.unsplash.com/photo-1713190277225-9a345031e9ac?ixid=M3wxMjA3fDB8MXxhbGx8MjR8fHx8fHwyfHwxNzEzMzI1MDkwfA&ixlib=rb-4.0.3,full/f63a09b3e5a1879c7c6c49d2940f04a52cab85fc.jpg
ABSOLUT,Ai generated portrait of a dark haired model wearing a pink shirt,https://images.unsplash.com/photo-1712847333453-740d9665aa5d?ixid=M3wxMjA3fDF8MXxhbGx8MTF8fHx8fHwyfHwxNzEzMzI1MDkwfA&ixlib=rb-4.0.3,full/158e4eadea1e89f17f7bf52e0a706d0be8bca39d.jpg
Dima Kapralov,a black and white photo of a man with a goatee,https://images.unsplash.com/photo-1713190184313-ffd62ed18fd0?ixid=M3wxMjA3fDB8MXxhbGx8MjB8fHx8fHwyfHwxNzEzMzI1MDkwfA&ixlib=rb-4.0.3,full/a45fb46796e47f105e3ce5462cfd73be71ce3872.jpg
Planet Volumes,a black and purple background with curves,https://plus.unsplash.com/premium_photo-1675553742348-dbb89004b2a2?ixid=M3wxMjA3fDB8MXxhbGx8NDd8fHx8fHwyfHwxNzEzMzI0NjM0fA&ixlib=rb-4.0.3,full/0451cae2f59dbb3a975ef44fe311ae994bddb33f.jpg
ABSOLUT,Ai generated portrait of a model looking at camera with red lipstick,https://images.unsplash.com/photo-1712847331947-9460dd2f264b?ixid=M3wxMjA3fDF8MXxhbGx8MjF8fHx8fHwyfHwxNzEzMzI1MDkwfA&ixlib=rb-4.0.3,full/d05b6d513498b7134addf90ad93e7ecb7e963137.jpg
Johannes Kopf,a man riding a bike on top of a road,https://plus.unsplash.com/premium_photo-1713184149461-67ad584d82e6?ixid=M3wxMjA3fDB8MXxhbGx8NDJ8fHx8fHwyfHwxNzEzMzI0NjM0fA&ixlib=rb-4.0.3,full/813ccd856210f30a8913b85169330dd0d6912b5f.jpg
William Warby,a black and white photo of a pier and a castle,https://images.unsplash.com/photo-1712921673202-2b312e13cd19?ixid=M3wxMjA3fDB8MXxhbGx8Mjh8fHx8fHwyfHwxNzEzMzI0NjMyfA&ixlib=rb-4.0.3,full/289aed03ec8f1240b9f443aa46e77fa9fe9b7392.jpg
Resource Database,a white cube that is floating in the air,https://images.unsplash.com/photo-1713199716594-033b0991c2c6?ixid=M3wxMjA3fDB8MXxhbGx8MzR8fHx8fHwyfHwxNzEzMzI0NjMyfA&ixlib=rb-4.0.3,full/a377d386ca6970c326a6dc3b8aa7381441f9cb15.jpg
ABSOLUT,Ai generated portrait of model with dark long hair and facial hair,https://images.unsplash.com/photo-1712847333437-f9386beb83e4?ixid=M3wxMjA3fDF8MXxhbGx8MTZ8fHx8fHwyfHwxNzEzMzI1MDkwfA&ixlib=rb-4.0.3,full/660e778c5111abf6c530d56550792b048ca18203.jpg
ABSOLUT,Ai generated portrait of a model wearing black tank top,https://images.unsplash.com/photo-1712847332442-87725fbd3091?ixid=M3wxMjA3fDF8MXxhbGx8MjZ8fHx8fHwyfHwxNzEzMzI0NjMyfA&ixlib=rb-4.0.3,full/f416df32d66a7eabb09ac79e3eaa3b117ca39e29.jpg
Toa Heftiba,a woman sitting at a table with a notebook in front of her,https://plus.unsplash.com/premium_photo-1683880731615-ecbf67bf7a8f?ixid=M3wxMjA3fDB8MXxhbGx8Mzd8fHx8fHwyfHwxNzEzMzI0NjMzfA&ixlib=rb-4.0.3,full/42a0a49593a17105e13dc097f6d829214c62b301.jpg
Andrew Keymaster,a black and white photo of a subway,https://images.unsplash.com/photo-1713187340827-45c991f6eecd?ixid=M3wxMjA3fDB8MXxhbGx8MzN8fHx8fHwyfHwxNzEzMzI0NjMyfA&ixlib=rb-4.0.3,full/8bf70f37486ab792357f06d48a2355931859d8de.jpg
Connor Noble,a woman walking down a sidewalk next to a grass covered field,https://images.unsplash.com/photo-1712720514664-bfe7262d7964?ixid=M3wxMjA3fDB8MXxhbGx8Mjl8fHx8fHwyfHwxNzEzMzI0NjMyfA&ixlib=rb-4.0.3,full/3446b2a801eb8e13642b0ce630782552c72a2e2f.jpg
Dima Kapralov,a black and white photo of a man in a suit,https://images.unsplash.com/photo-1713190190659-22fe536876f5?ixid=M3wxMjA3fDB8MXxhbGx8MzV8fHx8fHwyfHwxNzEzMzI0NjMyfA&ixlib=rb-4.0.3,full/4ab21cb5433e76c6e8330ce5470dd207caacd505.jpg
ABSOLUT,Ai generated portrait of model with short dark hair and bare shoulders,https://images.unsplash.com/photo-1712847331925-bf0e3fd2b7ae?ixid=M3wxMjA3fDF8MXxhbGx8MzF8fHx8fHwyfHwxNzEzMzI0NjMyfA&ixlib=rb-4.0.3,full/5729c6533304304ef346d16829cc93ad6953b55f.jpg
Evgeni Tcherkasski,a view of the night sky from the top of a mountain,https://images.unsplash.com/photo-1713245294954-c5805efcd5da?ixid=M3wxMjA3fDB8MXxhbGx8MjV8fHx8fHwyfHwxNzEzMzI0NjMyfA&ixlib=rb-4.0.3,full/622257459c81b7381a68e73135d041f6d2792702.jpg
Austin Curtis,a black and white photo of a train going down the tracks,https://images.unsplash.com/photo-1676546700210-d57374ef7c72?ixid=M3wxMjA3fDB8MXxhbGx8MzB8fHx8fHwyfHwxNzEzMzI0NjMyfA&ixlib=rb-4.0.3,full/36ff6edd9da6f02f997cb802a15caede604b0657.jpg
Nick Fancher,a woman with a blue face and purple hair,https://plus.unsplash.com/premium_photo-1706727287024-3d6c677819ee?ixid=M3wxMjA3fDB8MXxhbGx8NTJ8fHx8fHwyfHwxNzEzMzI0NjMzfA&ixlib=rb-4.0.3,full/b5e63e1426c116971d12553ea28d82fe12a437a1.jpg
Tetiana Kobzeva,a woman sitting on the ground holding a green plant,https://images.unsplash.com/photo-1713188702314-3adb3d686a50?ixid=M3wxMjA3fDB8MXxhbGx8NDB8fHx8fHwyfHwxNzEzMzI0NjM0fA&ixlib=rb-4.0.3,full/fc14381a58b188cf8d778a534c26655e6c10e3ed.jpg
Susan Wilkinson,a painting of flowers and leaves on a white background,https://images.unsplash.com/photo-1713205660475-bef0b48d1830?ixid=M3wxMjA3fDB8MXxhbGx8Mzl8fHx8fHwyfHwxNzEzMzI0NjM0fA&ixlib=rb-4.0.3,full/44855f2e15e8dc685088438222bd2c522748bb94.jpg
Kellen Riggin,the sun is setting over the ocean and rocks,https://images.unsplash.com/photo-1713236252021-00d5792e69e5?ixid=M3wxMjA3fDB8MXxhbGx8NDN8fHx8fHwyfHwxNzEzMzI0NjM0fA&ixlib=rb-4.0.3,full/885300d7240d5ab86c7e2e913842c599144a3ad1.jpg
Sebastian Knoll,a pink and blue star in the middle of a black sky,https://images.unsplash.com/photo-1713128596799-9c74cfe629e0?ixid=M3wxMjA3fDB8MXxhbGx8NDh8fHx8fHwyfHwxNzEzMzI0NjM0fA&ixlib=rb-4.0.3,full/f81c0703f060f718ae5311cd625e86f7e6fb4146.jpg
Luke Miller,a waterfall in the middle of a forest,https://images.unsplash.com/photo-1712971578942-8d44b2d77143?ixid=M3wxMjA3fDB8MXxhbGx8Mzh8fHx8fHwyfHwxNzEzMzI0NjM0fA&ixlib=rb-4.0.3,full/2dce7b50771e77d27542d84dc76f6749971eb6af.jpg
visualsofdana,a woman in a yellow dress standing in a cave,https://images.unsplash.com/photo-1712884504011-a1ebe9960938?ixid=M3wxMjA3fDB8MXxhbGx8NDR8fHx8fHwyfHwxNzEzMzI0NjM0fA&ixlib=rb-4.0.3,full/738b0b8cfe735e1003533bc65750dc87b5bf6cfa.jpg
Dave Solce,a couple of people that are flying some kites,https://images.unsplash.com/photo-1712841607084-3c8dabe07818?ixid=M3wxMjA3fDB8MXxhbGx8NDV8fHx8fHwyfHwxNzEzMzI0NjM0fA&ixlib=rb-4.0.3,full/8c6f641f0d25eedd879df52ff58ef9fd15a4f716.jpg
Alex Shuper,a tree in a field with a full moon in the background,https://plus.unsplash.com/premium_photo-1711136314731-8c3fe1831672?ixid=M3wxMjA3fDB8MXxhbGx8NTd8fHx8fHwyfHwxNzEzMzI0NjMzfA&ixlib=rb-4.0.3,full/92c9712dc05f6404c0fd46b2b0e9ce0bbbeaf264.jpg
Pawel Czerwinski,a blurry photo of a black background,https://images.unsplash.com/photo-1713171158499-9d1c96c881ec?ixid=M3wxMjA3fDB8MXxhbGx8NDl8fHx8fHwyfHwxNzEzMzI0NjMzfA&ixlib=rb-4.0.3,full/a6c958827f7fb7091095f0e261e67d3094304b9e.jpg
Evgeni Tcherkasski,a mountain with a road going through it under a night sky filled with stars,https://images.unsplash.com/photo-1713245275828-a83869408f96?ixid=M3wxMjA3fDB8MXxhbGx8NTB8fHx8fHwyfHwxNzEzMzI0NjMzfA&ixlib=rb-4.0.3,full/eb37bb070943b9139e99b31ec910aa9fa81806a8.jpg
ABSOLUT,Ai generated portrait of model with bare shoulders,https://images.unsplash.com/photo-1712847331931-8a0ea66c4904?ixid=M3wxMjA3fDF8MXxhbGx8NDZ8fHx8fHwyfHwxNzEzMzI0NjM0fA&ixlib=rb-4.0.3,full/b72b2eda7e34b077bba0789b57eda47749ec9bbc.jpg
Olimpia Davies,a person holding chopsticks over a bowl of food,https://plus.unsplash.com/premium_photo-1712849058524-7f5e94474fe6?ixid=M3wxMjA3fDB8MXxhbGx8NzJ8fHx8fHwyfHwxNzEzMzI0NjI5fA&ixlib=rb-4.0.3,full/e90cde2f3a16adca0fd33cd2b1454b02832a28d4.jpg
Dima Kapralov,a man holding a leaf up to his face,https://images.unsplash.com/photo-1713190197596-a1c2f4ae413c?ixid=M3wxMjA3fDB8MXxhbGx8NTN8fHx8fHwyfHwxNzEzMzI0NjMzfA&ixlib=rb-4.0.3,full/83e73e350512bb061d94b660f65e397b74bb0e3e.jpg
SHAYAN Rostami,a woman laying on the ground with her legs spread out,https://images.unsplash.com/photo-1713198893539-e7dfa3764bfd?ixid=M3wxMjA3fDB8MXxhbGx8NTl8fHx8fHwyfHwxNzEzMzI0NjMzfA&ixlib=rb-4.0.3,full/0665fd20c473ee3856268d1c99dcbe337357a83e.jpg
ABSOLUT,Ai generated portrait of a model posing with hands on hips,https://images.unsplash.com/photo-1712847333062-f641820692b0?ixid=M3wxMjA3fDF8MXxhbGx8MzZ8fHx8fHwyfHwxNzEzMzI0NjMyfA&ixlib=rb-4.0.3,full/6a671a13f6cbd986594d4c064cdd54e64ceaaa3f.jpg
HANVIN CHEONG,a green taxi cab driving past a cherry blossom tree,https://images.unsplash.com/photo-1713106216268-9d6faf591c36?ixid=M3wxMjA3fDB8MXxhbGx8NTR8fHx8fHwyfHwxNzEzMzI0NjMzfA&ixlib=rb-4.0.3,full/13de851fb0bbd7540b2918ba183a3255f0451d54.jpg
Agustin Farias,a man standing in front of a desk holding a cup,https://plus.unsplash.com/premium_photo-1705091306852-5d45b6cf7315?ixid=M3wxMjA3fDB8MXxhbGx8Njd8fHx8fHwyfHwxNzEzMzI0NjI5fA&ixlib=rb-4.0.3,full/c303cf2ed7a262981190349ea0cdc27eaf025a36.jpg
Sylwia Bartyzel,a close up of a building made of white tiles,https://images.unsplash.com/photo-1713169358680-ebf92684fb0b?ixid=M3wxMjA3fDB8MXxhbGx8NTh8fHx8fHwyfHwxNzEzMzI0NjMzfA&ixlib=rb-4.0.3,full/1077e9cb2b76bad85ca43ac728f12e380b932320.jpg
ABSOLUT,Ai generated portrait of a black haired model wearing a turtleneck,https://images.unsplash.com/photo-1712847332253-7e4cd84d8ff8?ixid=M3wxMjA3fDF8MXxhbGx8NTF8fHx8fHwyfHwxNzEzMzI0NjMzfA&ixlib=rb-4.0.3,full/8b120748b8d20b7c6d3d5a1a57ac7b6bf2f47ab1.jpg
ABSOLUT,Ai generated image of a short dark haired model looking at camera,https://images.unsplash.com/photo-1712847333419-227c1ce1c82a?ixid=M3wxMjA3fDF8MXxhbGx8NDF8fHx8fHwyfHwxNzEzMzI0NjM0fA&ixlib=rb-4.0.3,full/efd6f27adce0702816987a725af486ad0f2675f3.jpg
ABSOLUT,Ai generated portrait of a dark haired model wearing a black shirt,https://images.unsplash.com/photo-1712847331906-fac48177f9f7?ixid=M3wxMjA3fDF8MXxhbGx8NTZ8fHx8fHwyfHwxNzEzMzI0NjMzfA&ixlib=rb-4.0.3,full/499e60a2ecdfa8116392433535fdeb9d41bd1581.jpg
Susan Wilkinson,a close up of a pink and yellow flower on a white background,https://images.unsplash.com/photo-1712861824520-dc002b4cdaf2?ixid=M3wxMjA3fDB8MXxhbGx8Njh8fHx8fHwyfHwxNzEzMzI0NjI5fA&ixlib=rb-4.0.3,full/f4a5494a8a8285262c03908858ce95f8e1d2d52d.jpg
Nik,a tree filled with lots of pink flowers,https://images.unsplash.com/photo-1713073530306-271688b2f144?ixid=M3wxMjA3fDB8MXxhbGx8NjN8fHx8fHwyfHwxNzEzMzI0NjI5fA&ixlib=rb-4.0.3,full/148d65256eff746c60e5a89a288befa5e90aec8b.jpg
Pablo Merchán Montes,a pregnant woman standing in front of a wooden door,https://plus.unsplash.com/premium_photo-1712848751465-cf470a8a2112?ixid=M3wxMjA3fDB8MXxhbGx8Nzd8fHx8fHwyfHwxNzEzMzI0NjMzfA&ixlib=rb-4.0.3,full/1c8ac324c93ef2493d8f59c30c1842f6baee0c97.jpg
Danielle Suijkerbuijk,a group of pink and white flowers on a pink background,https://images.unsplash.com/photo-1712925371825-78e9f8592208?ixid=M3wxMjA3fDB8MXxhbGx8NjV8fHx8fHwyfHwxNzEzMzI0NjI5fA&ixlib=rb-4.0.3,full/9e2df42dd46107fc41a72814a064024f8309e7c2.jpg
Pawel Czerwinski,a close up of a purple background with wavy lines,https://images.unsplash.com/photo-1713171158509-f2a6582581a0?ixid=M3wxMjA3fDB8MXxhbGx8NjB8fHx8fHwyfHwxNzEzMzI0NjMzfA&ixlib=rb-4.0.3,full/18fedf2b2dd80d58b600e032bd23665ed53cc015.jpg
Polina Kuzovkova,a branch with pink flowers against a blue sky,https://plus.unsplash.com/premium_photo-1664116928414-2ab998603666?ixid=M3wxMjA3fDB8MXxhbGx8ODJ8fHx8fHwyfHwxNzEzMzI0NjMzfA&ixlib=rb-4.0.3,full/f0ef6e0f81718ac7a8ce384c8024eb88e43e85b9.jpg
Connor Noble,a woman leaning on a rail next to a train track,https://images.unsplash.com/photo-1712720533819-7f72b3175e3f?ixid=M3wxMjA3fDB8MXxhbGx8Njl8fHx8fHwyfHwxNzEzMzI0NjI5fA&ixlib=rb-4.0.3,full/e7e53d5e12892623882a92293c92cc0fdd960159.jpg
Raul Guillermo,a man taking a picture with a camera,https://plus.unsplash.com/premium_photo-1683318596886-3ba591e65918?ixid=M3wxMjA3fDB8MXxhbGx8NjJ8fHx8fHwyfHwxNzEzMzI0NjI5fA&ixlib=rb-4.0.3,full/7ecb14d47efe753c1cee7c8e4f038684ed270d9f.jpg
Jubéo Hernandez,a large swimming pool with a slide in the middle of it,https://images.unsplash.com/photo-1713204114860-094adeaa7742?ixid=M3wxMjA3fDB8MXxhbGx8NzB8fHx8fHwyfHwxNzEzMzI0NjI5fA&ixlib=rb-4.0.3,full/98860a1d3f91db44c41351604e6956330293a91a.jpg
BehindTheTmuna,a man with pink hair and a black shirt,https://images.unsplash.com/photo-1712436400731-dd401be07e4c?ixid=M3wxMjA3fDB8MXxhbGx8NjR8fHx8fHwyfHwxNzEzMzI0NjI5fA&ixlib=rb-4.0.3,full/cea115cb06772bd02e92327f8b25c44974b83636.jpg
力力摄影日记,a view of a city at night from across the water,https://images.unsplash.com/photo-1713101817883-c586574cb4cc?ixid=M3wxMjA3fDB8MXxhbGx8NTV8fHx8fHwyfHwxNzEzMzI0NjMzfA&ixlib=rb-4.0.3,full/25017da0bb3d10bad59eb5c376f1a0ebfe9a06a8.jpg
Elvis Amaya,a woman standing in front of a body of water,https://images.unsplash.com/photo-1713127686686-7d8892fff7f5?ixid=M3wxMjA3fDB8MXxhbGx8NzR8fHx8fHwyfHwxNzEzMzI0NjMzfA&ixlib=rb-4.0.3,full/e825001db0bab32ece775cbee025523e339a6040.jpg
力力摄影日记,a group of hot air balloons flying over a city,https://images.unsplash.com/photo-1713101888073-76cc3a9e441a?ixid=M3wxMjA3fDB8MXxhbGx8NzN8fHx8fHwyfHwxNzEzMzI0NjMzfA&ixlib=rb-4.0.3,full/9521a799fb37ff63f35039c336fb2f78ce50b597.jpg
Clay Banks,a wooden table sitting under a stair case,https://images.unsplash.com/photo-1713184359231-832519897def?ixid=M3wxMjA3fDB8MXxhbGx8Nzl8fHx8fHwyfHwxNzEzMzI0NjMzfA&ixlib=rb-4.0.3,full/544908420bddd93323cb5e9c7333aed0df356695.jpg
ABSOLUT,Ai generated portrait of a freckled model with bare shoulders,https://images.unsplash.com/photo-1712847333412-095c6ac70588?ixid=M3wxMjA3fDF8MXxhbGx8NjF8fHx8fHwyfHwxNzEzMzI0NjI5fA&ixlib=rb-4.0.3,full/e4071ab15bc44e8ea42f48759f5f51d20e110316.jpg
Apostolos Vamvouras,a person holding a plate with a sandwich on it,https://images.unsplash.com/photo-1713209270646-a6531eda7afd?ixid=M3wxMjA3fDB8MXxhbGx8Nzh8fHx8fHwyfHwxNzEzMzI0NjMzfA&ixlib=rb-4.0.3,full/571012940ae4f86d47985b5b8793b002c1c5f463.jpg
Gabrielle Maurer,a couple of boats that are sitting in the water,https://plus.unsplash.com/premium_photo-1712933121311-dcdc41d9fb17?ixid=M3wxMjA3fDB8MXxhbGx8OTJ8fHx8fHwyfHwxNzEzMzI0NjI4fA&ixlib=rb-4.0.3,full/a106053c7af24bf5b5adff94e58d4d3b2b1effd1.jpg
Venti Views,a person standing on top of a hill at sunset,https://images.unsplash.com/photo-1712955685153-1b9c8edd071f?ixid=M3wxMjA3fDB8MXxhbGx8ODN8fHx8fHwyfHwxNzEzMzI0NjMzfA&ixlib=rb-4.0.3,full/27e42799e1748c4ca0e6ae8c7f6900ca05afd3e1.jpg
ABSOLUT,Ai generated portrait of a model with short dark hair,https://images.unsplash.com/photo-1712847333364-296afd7ba69a?ixid=M3wxMjA3fDF8MXxhbGx8NjZ8fHx8fHwyfHwxNzEzMzI0NjI5fA&ixlib=rb-4.0.3,full/aed1beea6fae51762442bc770794574a7b2baa6c.jpg
Clay Banks,a kitchen counter with a coffee maker and cups on it,https://images.unsplash.com/photo-1712926097966-b86f0d8c131d?ixid=M3wxMjA3fDB8MXxhbGx8ODR8fHx8fHwyfHwxNzEzMzI0NjMzfA&ixlib=rb-4.0.3,full/5f1756d3157b470a8431ccc2c206e54bb61ea804.jpg
Olegs Jonins,a person riding a surf board on a body of water,https://images.unsplash.com/photo-1712858286350-705f84b25824?ixid=M3wxMjA3fDB8MXxhbGx8ODh8fHx8fHwyfHwxNzEzMzI0NjI4fA&ixlib=rb-4.0.3,full/87d1026b072ad83469dce83ee9f90485c9b9e3c9.jpg
ABSOLUT,Ai generated portrait of a model with polka dot shirt,https://images.unsplash.com/photo-1712847333429-a33a019c3589?ixid=M3wxMjA3fDF8MXxhbGx8NzF8fHx8fHwyfHwxNzEzMzI0NjI5fA&ixlib=rb-4.0.3,full/9fc928080aeda4a307581f9158bda8c489d53ea3.jpg
Hans Isaacson,a wooden walkway leading to a valley with mountains in the background,https://plus.unsplash.com/premium_photo-1691434474131-01f982a2dab1?ixid=M3wxMjA3fDB8MXxhbGx8ODd8fHx8fHwyfHwxNzEzMzI0NjI4fA&ixlib=rb-4.0.3,full/aee970177397f409bd9db66e9f9c32e25337519b.jpg
Aleksandar Andreev,a man and a woman walking along a pier,https://images.unsplash.com/photo-1713208176864-13e6c9d04eec?ixid=M3wxMjA3fDB8MXxhbGx8ODB8fHx8fHwyfHwxNzEzMzI0NjMzfA&ixlib=rb-4.0.3,full/f5836ef4c0abfa12cebdea3471e06f3c606fa545.jpg
ABSOLUT,Ai generated photo of two models posing together,https://images.unsplash.com/photo-1712847332449-3791c8810949?ixid=M3wxMjA3fDF8MXxhbGx8NzZ8fHx8fHwyfHwxNzEzMzI0NjMzfA&ixlib=rb-4.0.3,full/0579483dad0608d23c2f2c5531002d6745b50e02.jpg
Andrej Lišakov,a man in a yellow shirt and white pants sitting on a ledge,https://plus.unsplash.com/premium_photo-1711508489210-80940a5bf60a?ixid=M3wxMjA3fDB8MXxhbGx8MTA3fHx8fHx8Mnx8MTcxMzMyNDYzMnw&ixlib=rb-4.0.3,full/1e6e84cc775846ef8959a7e5a7369eccf6e0631c.jpg
badbright,a group of colorful mushrooms on a yellow background,https://plus.unsplash.com/premium_photo-1691960547774-0c8aa64de409?ixid=M3wxMjA3fDB8MXxhbGx8OTd8fHx8fHwyfHwxNzEzMzI0NjMyfA&ixlib=rb-4.0.3,full/d10f46bf066708204847252a46c6ab0eb72104c8.jpg
Євгенія Височина,a person sitting at a table with a cup of coffee,https://images.unsplash.com/photo-1713105227378-91e790dfe4f0?ixid=M3wxMjA3fDB8MXxhbGx8OTB8fHx8fHwyfHwxNzEzMzI0NjI4fA&ixlib=rb-4.0.3,full/c99e0e27d755a1d6b75822258199634df0901979.jpg
Mathias Reding,a sandy beach next to the ocean with waves coming in,https://images.unsplash.com/photo-1712939707471-15dbed487f51?ixid=M3wxMjA3fDB8MXxhbGx8ODV8fHx8fHwyfHwxNzEzMzI0NjI4fA&ixlib=rb-4.0.3,full/a79f6030dfd247541563341211908e302a093c8c.jpg
ABSOLUT,Ai generated image of a dark haired model in black dress with hands on hips,https://images.unsplash.com/photo-1712847331865-f11e31be73cf?ixid=M3wxMjA3fDF8MXxhbGx8ODZ8fHx8fHwyfHwxNzEzMzI0NjI4fA&ixlib=rb-4.0.3,full/fbe5c6b932f3ad884ef83d8278b9afda508694aa.jpg
ALLAN LAINEZ,a woman in an orange pants and a blue jacket,https://images.unsplash.com/photo-1713145869614-2621705ef5c4?ixid=M3wxMjA3fDB8MXxhbGx8OTN8fHx8fHwyfHwxNzEzMzI0NjI4fA&ixlib=rb-4.0.3,full/eadcd6631998139c6449b4ed36188b1224be39ef.jpg
ABSOLUT,Ai generated image of a short haired model looking off camera ,https://images.unsplash.com/photo-1712847332419-7bb0475464aa?ixid=M3wxMjA3fDF8MXxhbGx8ODF8fHx8fHwyfHwxNzEzMzI0NjMzfA&ixlib=rb-4.0.3,full/3a9b2a827810281fe6ac46f192d49425693fd720.jpg
Dwayne joe,a woman brushing her teeth in front of a mirror,https://images.unsplash.com/photo-1712877334077-bbfb3475a597?ixid=M3wxMjA3fDB8MXxhbGx8ODl8fHx8fHwyfHwxNzEzMzI0NjI4fA&ixlib=rb-4.0.3,full/989431989e24c2680659fb43d4242776faaf4671.jpg
Clay Banks,a wooden cutting board sitting on top of a counter,https://images.unsplash.com/photo-1712925975246-7b1b8df829e2?ixid=M3wxMjA3fDB8MXxhbGx8OTl8fHx8fHwyfHwxNzEzMzI0NjMyfA&ixlib=rb-4.0.3,full/625a5968d5e3c33e26a77e1efb8241db2474b5c0.jpg
ABSOLUT,Ai generated portrait of a model laying with hand on head,https://images.unsplash.com/photo-1712847331843-b1118196c447?ixid=M3wxMjA3fDF8MXxhbGx8OTF8fHx8fHwyfHwxNzEzMzI0NjI4fA&ixlib=rb-4.0.3,full/cad29ce02210f1ea5dbf56b835b23919b7b5803a.jpg
Alyssa Smith,a man sitting on the floor in a room,https://plus.unsplash.com/premium_photo-1705091982008-b40865cb9c26?ixid=M3wxMjA3fDB8MXxhbGx8MTAyfHx8fHx8Mnx8MTcxMzMyNDYzMnw&ixlib=rb-4.0.3,full/3cf99681c6ce37eb050cd8ef30c25177cd2ed1d2.jpg
Catia Dombaxe,a person sitting at a table with a book and a drink,https://images.unsplash.com/photo-1712371962512-bfb8588dfebd?ixid=M3wxMjA3fDB8MXxhbGx8OTV8fHx8fHwyfHwxNzEzMzI0NjI4fA&ixlib=rb-4.0.3,full/71f9f1f89c135607f63fec414816e10a8b5b8912.jpg
Mathias Reding,a view of the ocean from a cliff,https://images.unsplash.com/photo-1712939706943-b6b3b4549937?ixid=M3wxMjA3fDB8MXxhbGx8OTh8fHx8fHwyfHwxNzEzMzI0NjMyfA&ixlib=rb-4.0.3,full/58e056be6956a7ed92efc25bcd4087e61e5bd04c.jpg
Yuri Krupenin,the shadow of a bicycle on a wall,https://images.unsplash.com/photo-1713042451651-42cecb8a2e19?ixid=M3wxMjA3fDB8MXxhbGx8MTAwfHx8fHx8Mnx8MTcxMzMyNDYzMnw&ixlib=rb-4.0.3,full/d2d40d543c1186445079a165daa0491c98a2ad51.jpg
The Cleveland Museum of Art,a painting of a group of people in a palace,https://images.unsplash.com/photo-1713103660271-3b1ffe5bba5d?ixid=M3wxMjA3fDB8MXxhbGx8NzV8fHx8fHwyfHwxNzEzMzI0NjMzfA&ixlib=rb-4.0.3,full/3748b1b6cd52558d427322e19afa13d4b76db9f5.jpg
The Cleveland Museum of Art,a painting of a man standing on a hill,https://images.unsplash.com/photo-1713118774750-e1878e76b067?ixid=M3wxMjA3fDB8MXxhbGx8MTAzfHx8fHx8Mnx8MTcxMzMyNDYzMnw&ixlib=rb-4.0.3,full/ba1f686c90a37a52d2ead04c1c1ba43144cd60c0.jpg
Kyle Vaughn,a bunch of white flowers hanging from a tree,https://images.unsplash.com/photo-1713145997711-f18e9b079059?ixid=M3wxMjA3fDB8MXxhbGx8MTA0fHx8fHx8Mnx8MTcxMzMyNDYzMnw&ixlib=rb-4.0.3,full/33d654150d4f677f59fa77b9e082fad476c22f99.jpg
ABSOLUT,Ai generated portrait of a blond model with bare shoulders,https://images.unsplash.com/photo-1712857329031-eecb5980eec7?ixid=M3wxMjA3fDF8MXxhbGx8MTAxfHx8fHx8Mnx8MTcxMzMyNDYzMnw&ixlib=rb-4.0.3,full/a064dadc967826a48e0af97bc285893ebaa7757e.jpg
eberhard 🖐 grossgasteiger,a view of a mountain range through a cave,https://images.unsplash.com/photo-1713080045896-0b78f9a6bb55?ixid=M3wxMjA3fDB8MXxhbGx8OTR8fHx8fHwyfHwxNzEzMzI0NjI4fA&ixlib=rb-4.0.3,full/2f1001ba42237fc1f8b4902889c2bef7e8ed90d1.jpg
